speaker,text,type,election_year,date,candidate,qud,question,similarity_cls,similarity_max,similarity_mean,similarity_sbert,party,question_clean,qud_answer_fit,qud_question_fit,winner
Hillary Clinton,… or at an airport near you.,Pres,2016,2016-09-26,1,,,,,,,Democratic,,,,0.0
Lester Holt,Were going to move to…,Pres,2016,2016-09-26,0,,,,,,,Moderator,,,,
Hillary Clinton,"But its because I see this— we need to have strong growth, fair growth, sustained growth. We also have to look at how we help families balance the responsibilities at home and the responsibilities at business. So we have a very robust set of plans. And people have looked at both of our plans, have concluded that mine would create 10 million jobs and yours would lose us 3. 5 million jobs, and explode the debt which would have a recession.",Pres,2016,2016-09-26,1,,,,,,,Democratic,,,,0.0
Donald Trump,"You are going to approve one of the biggest tax cuts in history. You are going to approve one of the biggest tax increases in history. You are going to drive business out. Your regulations are a disaster, and youre going to increase regulations all over the place. And by the way, my tax cut is the biggest since Ronald Reagan. Im very proud of it. It will create tremendous numbers of new jobs. But regulations, you are going to regulate these businesses out of existence. When I go around— Lester, I tell you this, Ive been all over. And when I go around, despite the tax cut, the thing— the things that business as in people like the most is the fact that Im cutting regulation. You have regulations on top of regulations, and new companies cannot form and old companies are going out of business. And you want to increase the regulations and make them even worse. Im going to cut regulations. Im going to cut taxes big league, and youre going to raise taxes big league, end of story.",Pres,2016,2016-09-26,1,,,,,,,Republican,,,,1.0
Lester Holt,"Let me get you to pause right there, because were going to move into— were going to move into the next segment. Were going to talk taxes…",Pres,2016,2016-09-26,0,,,,,,,Moderator,,,,
Hillary Clinton,That cant— that cant be left to stand.,Pres,2016,2016-09-26,1,,,,,,,Democratic,,,,0.0
Lester Holt,Please just take 30 seconds and then were going to go on.,Pres,2016,2016-09-26,0,,,,,,,Moderator,,,,
Hillary Clinton,"I kind of assumed that there would be a lot of these charges and claims, and so…",Pres,2016,2016-09-26,1,,,,,,,Democratic,,,,0.0
Donald Trump,Facts.,Pres,2016,2016-09-26,1,,,,,,,Republican,,,,1.0
Hillary Clinton,"So we have taken the home page of my website, HillaryClinton. com, and weve turned it into a fact- checker. So if you want to see in real- time what the facts are, please go and take a look. Because what I have proposed…",Pres,2016,2016-09-26,1,,,,,,,Democratic,,,,0.0
Donald Trump,"And take a look at mine, also, and youll see.",Pres,2016,2016-09-26,1,,,,,,,Republican,,,,1.0
Hillary Clinton,"… would not add a penny to the debt, and your plans would add $5 trillion to the debt. What I have proposed would cut regulations and streamline them for small businesses. What I have proposed would be paid for by raising taxes on the wealthy, because they have made all the gains in the economy. And I think its time that the wealthy and corporations paid their fair share to support this country.",Pres,2016,2016-09-26,1,,,,,,,Democratic,,,,0.0
Lester Holt,"Well, you just opened the next segment.",Pres,2016,2016-09-26,0,,,,,,,Moderator,,,,
Donald Trump,"Well, could I just finish— I think I… [crosstalk]",Pres,2016,2016-09-26,1,,,,,,,Republican,,,,1.0
Lester Holt,Im going to give you a chance right here…,Pres,2016,2016-09-26,0,,,,,,,Moderator,,,,
Donald Trump,"I think I should— you go to her website, and you take a look at her website.",Pres,2016,2016-09-26,1,,,,,,,Republican,,,,1.0
Lester Holt,… with a new 15- minute segment…,Pres,2016,2016-09-26,0,,,,,,,Moderator,,,,
Donald Trump,Shes going to raise taxes $1. 3 trillion.,Pres,2016,2016-09-26,1,,,,,,,Republican,,,,1.0
Lester Holt,"Mr. Trump, Im going to…",Pres,2016,2016-09-26,0,,,,,,,Moderator,,,,
Donald Trump,And look at her website. You know what? Its no difference than this. Shes telling us how to fight ISIS. Just go to her website. She tells you how to fight ISIS on her website. I dont think General Douglas MacArthur would like that too much.,Pres,2016,2016-09-26,1,,,,,,,Republican,,,,1.0
Lester Holt,"The next segment, were continuing…",Pres,2016,2016-09-26,0,,,,,,,Moderator,,,,
Hillary Clinton,"Well, at least I have a plan to fight ISIS.",Pres,2016,2016-09-26,1,,,,,,,Democratic,,,,0.0
Lester Holt,… achieving prosperity…,Pres,2016,2016-09-26,0,,,,,,,Moderator,,,,
Donald Trump,"No, no, youre telling the enemy everything you want to do.",Pres,2016,2016-09-26,1,,,,,,,Republican,,,,1.0
Hillary Clinton,"No, were not. No, were not.",Pres,2016,2016-09-26,1,,,,,,,Democratic,,,,0.0
Donald Trump,"See, youre telling the enemy everything you want to do. No wonder youve been fighting— no wonder youve been fighting ISIS your entire adult life.",Pres,2016,2016-09-26,1,,,,,,,Republican,,,,1.0
Hillary Clinton,"Thats a— thats— go to the— please, fact checkers, get to work.",Pres,2016,2016-09-26,1,,,,,,,Democratic,,,,0.0
Lester Holt,"ok, you are unpacking a lot here. And were still on the issue of achieving prosperity. And I want to talk about taxes. The fundamental difference between the two of you concerns the wealthy. Secretary Clinton, youre calling for a tax increase on the wealthiest Americans. Id like you to further defend that. And, Mr. Trump, youre calling for tax cuts for the wealthy. Id like you to defend that. And this next two- minute answer goes to you, Mr. Trump.",Pres,2016,2016-09-26,0,,,,,,,Moderator,,,,
Donald Trump,"Well, Im really calling for major jobs, because the wealthy are going to create tremendous jobs. Theyre going to expand their companies. Theyre going to do a tremendous job. Im getting rid of the carried interest provision. And if you really look, its not a tax— its really not a great thing for the wealthy. Its a great thing for the middle class. Its a great thing for companies to expand. And when these people are going to put billions and billions of dollars into companies, and when theyre going to bring $2. 5 trillion back from overseas, where they cant bring the money back, because politicians like Secretary Clinton wont allow them to bring the money back, because the taxes are so onerous, and the bureaucratic red tape, so what— is so bad. So what theyre doing is theyre leaving our country, and theyre, believe it or not, leaving because taxes are too high and because some of them have lots of money outside of our country. And instead of bringing it back and putting the money to work, because they cant work out a deal to— and everybody agrees it should be brought back. Instead of that, theyre leaving our country to get their money, because they cant bring their money back into our country, because of bureaucratic red tape, because they cant get together. Because we have— we have a president that cant sit them around a table and get them to approve something. And heres the thing. Republicans and Democrats agree that this should be done, $2. 5 trillion. I happen to think its double that. Its probably $5 trillion that we cant bring into our country, Lester. And with a little leadership, youd get it in here very quickly, and it could be put to use on the inner cities and lots of other things, and it would be beautiful. But we have no leadership. And honestly, that starts with Secretary Clinton.",Pres,2016,2016-09-26,1,How can the United States encourage wealthy individuals to bring their overseas earnings back and invest in job creation?,"And I want to talk about taxes. The fundamental difference between the two of you concerns the wealthy. Secretary Clinton, youre calling for a tax increase on the wealthiest Americans. Id like you to further defend that. And, Mr. Trump, youre calling for tax cuts for the wealthy. Id like you to defend that. ",0.8340010643,0.9238688946,0.7345200181,0.2864167094,Republican,"Secretary Clinton, can you further defend your call for a tax increase on the wealthiest Americans, and Mr. Trump, can you defend your call for tax cuts for the wealthy?",3.0,3.0,1.0
Lester Holt,"All right. You have two minutes of the same question to defend tax increases on the wealthiest Americans, Secretary Clinton.",Pres,2016,2016-09-26,0,,,,,,,Moderator,,,,
Hillary Clinton,"I have a feeling that by, the end of this evening, Im going to be blamed for everything thats ever happened.",Pres,2016,2016-09-26,1,What do you expect will happen by the end of the evening in terms of blame or accountability?,"And I want to talk about taxes. The fundamental difference between the two of you concerns the wealthy. Secretary Clinton, youre calling for a tax increase on the wealthiest Americans. Id like you to further defend that. And, Mr. Trump, youre calling for tax cuts for the wealthy. Id like you to defend that. ",0.9159868956,0.9104378223,0.7361236215,0.2069960684,Democratic,What is your position on tax increases for the wealthy?,3.0,1.0,0.0
Donald Trump,Why not?,Pres,2016,2016-09-26,1,,,,,,,Republican,,,,1.0
Hillary Clinton,"Why not? Yeah, why not? [laughter] You know, just join the debate by saying more crazy things. Now, let me say this, it is absolutely the case…",Pres,2016,2016-09-26,1,,,,,,,Democratic,,,,0.0
Donald Trump,Theres nothing crazy about not letting our companies bring their money back into their country.,Pres,2016,2016-09-26,1,,,,,,,Republican,,,,1.0
Lester Holt,"This is— this is Secretary Clintons two minutes, please.",Pres,2016,2016-09-26,0,,,,,,,Moderator,,,,
Donald Trump,Yes.,Pres,2016,2016-09-26,1,,,,,,,Republican,,,,1.0
Hillary Clinton,"Yeah, well, lets start the clock again, Lester. Weve looked at your tax proposals. I dont see changes in the corporate tax rates or the kinds of proposals youre referring to that would cause the repatriation, bringing back of money thats stranded overseas. I happen to support that.",Pres,2016,2016-09-26,1,,,,,,,Democratic,,,,0.0
Donald Trump,Then you didnt read it.,Pres,2016,2016-09-26,1,,,,,,,Republican,,,,1.0
Hillary Clinton,"I happen to— I happen to support that in a way that will actually work to our benefit. But when I look at what you have proposed, you have what is called now the Trump loophole, because it would so advantage you and the business you do. Youve proposed an approach that has a…",Pres,2016,2016-09-26,1,,,,,,,Democratic,,,,0.0
Donald Trump,Who gave it that name? The first Ive— who gave it that name? [crosstalk],Pres,2016,2016-09-26,1,,,,,,,Republican,,,,1.0
Lester Holt,"Mr. Trump, this is Secretary Clintons two minutes.",Pres,2016,2016-09-26,0,,,,,,,Moderator,,,,
Hillary Clinton,… $4 billion tax benefit for your family. And when you look at what you are proposing…,Pres,2016,2016-09-26,1,,,,,,,Democratic,,,,0.0
Donald Trump,How much? How much for my family?,Pres,2016,2016-09-26,1,,,,,,,Republican,,,,1.0
Hillary Clinton,… it is…,Pres,2016,2016-09-26,1,,,,,,,Democratic,,,,0.0
Donald Trump,"Lester, how much?",Pres,2016,2016-09-26,1,,,,,,,Republican,,,,1.0
Hillary Clinton,"… as I said, trumped- up trickle- down. Trickle- down did not work. It got us into the mess we were in, in 2008 and 2009. Slashing taxes on the wealthy hasnt worked. And a lot of really smart, wealthy people know that. And they are saying, hey, we need to do more to make the contributions we should be making to rebuild the middle class. I dont think top- down works in America. I think building the middle class, investing in the middle class, making college debt- free so more young people can get their education, helping people refinance their— their debt from college at a lower rate. Those are the kinds of things that will really boost the economy. Broad- based, inclusive growth is what we need in America, not more advantages for people at the very top.",Pres,2016,2016-09-26,1,,,,,,,Democratic,,,,0.0
Lester Holt,"Mr. Trump, were…",Pres,2016,2016-09-26,0,,,,,,,Moderator,,,,
Donald Trump,"Typical politician. All talk, no action. Sounds good, doesnt work. Never going to happen. Our country is suffering because people like Secretary Clinton have made such bad decisions in terms of our jobs and in terms of whats going on. Now, look, we have the worst revival of an economy since the Great Depression. And believe me; Were in a bubble right now. And the only thing that looks good is the stock market, but if you raise interest rates even a little bit, thats going to come crashing down. We are in a big, fat, ugly bubble. And we better be awfully careful. And we have a Fed thats doing political things. This Janet Yellen of the Fed. The Fed is doing political— by keeping the interest rates at this level. And believe me; The day Obama goes off, and he leaves, and goes out to the golf course for the rest of his life to play golf, when they raise interest rates, youre going to see some very bad things happen, because the Fed is not doing their job. The Fed is being more political than Secretary Clinton.",Pres,2016,2016-09-26,1,,,,,,,Republican,,,,1.0
Lester Holt,"Mr. Trump, were talking about the burden that Americans have to pay, yet you have not released your tax returns. And the reason nominees have released their returns for decades is so that voters will know if their potential president owes money to— who he owes it to and any business conflicts. Dont Americans have a right to know if there are any conflicts of interest?",Pres,2016,2016-09-26,0,,,,,,,Moderator,,,,
Donald Trump,"I dont mind releasing— Im under a routine audit. And itll be released. And— as soon as the audits finished, it will be released. But you will learn more about Donald Trump by going down to the federal elections, where I filed a 104- page essentially financial statement of sorts, the forms that they have. It shows income— in fact, the income— I just looked today— the income is filed at $694 million for this past year, $694 million. If you would have told me I was going to make that 15 or 20 years ago, I would have been very surprised. But thats the kind of thinking that our country needs. When we have a country thats doing so badly, thats being ripped off by every single country in the world, its the kind of thinking that our country needs, because everybody— Lester, we have a trade deficit with all of the countries that we do business with, of almost $800 billion a year. You know what that is? That means, whos negotiating these trade deals? We have people that are political hacks negotiating our trade deals.",Pres,2016,2016-09-26,1,What is the importance of financial transparency and effective negotiation in improving the United States' economic situation and trade deals?,"You were talking about the burden that Americans have to pay, yet you have not released your tax returns. And the reason nominees have released their returns for decades is so that voters will know if their potential president owes money to— who he owes it to and any business conflicts. Dont Americans have a right to know if there are any conflicts of interest?",0.88297683,0.9075407982,0.7181715965,0.3084993362,Republican,Don't Americans have a right to know if there are any conflicts of interest?,3.0,3.0,1.0
Lester Holt,The IRS says an audit…,Pres,2016,2016-09-26,0,,,,,,,Moderator,,,,
Donald Trump,Excuse me.,Pres,2016,2016-09-26,1,,,,,,,Republican,,,,1.0
Lester Holt,"… of your taxes— youre perfectly free to release your taxes during an audit. And so the question, does the publics right to know outweigh your personal…",Pres,2016,2016-09-26,0,,,,,,,Moderator,,,,
Donald Trump,"Well, I told you, I will release them as soon as the audit. Look, Ive been under audit almost for 15 years. I know a lot of wealthy people that have never been audited. I said, do you get audited? I get audited almost every year. And in a way, I should be complaining. Im not even complaining. I dont mind it. Its almost become a way of life. I get audited by the IRS. But other people dont. I will say this. We have a situation in this country that has to be taken care of. I will release my tax returns— against my lawyers wishes— when she releases her 33, 000 e- mails that have been deleted. As soon as she releases them, I will release. [applause] I will release my tax returns. And thats against— my lawyers, they say, “Dont do it. ” I will tell you this. No— in fact, watching shows, theyre reading the papers. Almost every lawyer says, you dont release your returns until the audits complete. When the audits complete, Ill do it. But I would go against them if she releases her e- mails.",Pres,2016,2016-09-26,1,,,,,,,Republican,,,,1.0
Lester Holt,So its negotiable?,Pres,2016,2016-09-26,0,,,,,,,Moderator,,,,
Donald Trump,"Its not negotiable, no. Let her release the e- mails. Why did she delete 33, 000…",Pres,2016,2016-09-26,1,,,,,,,Republican,,,,1.0
Lester Holt,"Well, Ill let her answer that. But let me just admonish the audience one more time. There was an agreement. We did ask you to be silent, so it would be helpful for us. Secretary Clinton?",Pres,2016,2016-09-26,0,,,,,,,Moderator,,,,
Hillary Clinton,"Well, I think youve just seen another example of bait- and- switch here. For 40 years, everyone running for president has released their tax returns. You can go and see nearly, I think, 39, 40 years of our tax returns, but everyone has done it. We know the IRS has made clear there is no prohibition on releasing it when youre under audit. So youve got to ask yourself, why wont he release his tax returns? And I think there may be a couple of reasons. First, maybe hes not as rich as he says he is. Second, maybe hes not as charitable as he claims to be. Third, we dont know all of his business dealings, but we have been told through investigative reporting that he owes about $650 million to Wall Street and foreign banks. Or maybe he doesnt want the American people, all of you watching tonight, to know that hes paid nothing in federal taxes, because the only years that anybodys ever seen were a couple of years when he had to turn them over to state authorities when he was trying to get a casino license, and they showed he didnt pay any federal income tax.",Pres,2016,2016-09-26,1,Why is it important for presidential candidates to release their tax returns?,"You were talking about the burden that Americans have to pay, yet you have not released your tax returns. And the reason nominees have released their returns for decades is so that voters will know if their potential president owes money to— who he owes it to and any business conflicts. Dont Americans have a right to know if there are any conflicts of interest?",0.9226201773,0.9106550217,0.7494716644,0.2522201538,Democratic,Don't Americans have a right to know if there are any conflicts of interest?,3.0,3.0,0.0
Donald Trump,That makes me smart.,Pres,2016,2016-09-26,1,,,,,,,Republican,,,,1.0
Hillary Clinton,"So if hes paid zero, that means zero for troops, zero for vets, zero for schools or health. And I think probably hes not all that enthusiastic about having the rest of our country see what the real reasons are, because it must be something really important, even terrible, that hes trying to hide. And the financial disclosure statements, they dont give you the tax rate. They dont give you all the details that tax returns would. And it just seems to me that this is something that the American people deserve to see. And I have no reason to believe that hes ever going to release his tax returns, because theres something hes hiding. And well guess. Well keep guessing at what it might be that hes hiding. But I think the question is, were he ever to get near the White House, what would be those conflicts? Who does he owe money to? Well, he owes you the answers to that, and he should provide them.",Pres,2016,2016-09-26,1,,,,,,,Democratic,,,,0.0
Lester Holt,He also— he also raised the issue of your e- mails. Do you want to respond to that?,Pres,2016,2016-09-26,0,,,,,,,Moderator,,,,
Hillary Clinton,"I do. You know, I made a mistake using a private e- mail.",Pres,2016,2016-09-26,1,,,,,,,Democratic,,,,0.0
Donald Trump,Thats for sure.,Pres,2016,2016-09-26,1,,,,,,,Republican,,,,1.0
Hillary Clinton,"And if I had to do it over again, I would, obviously, do it differently. But Im not going to make any excuses. It was a mistake, and I take responsibility for that.",Pres,2016,2016-09-26,1,,,,,,,Democratic,,,,0.0
Lester Holt,Mr. Trump?,Pres,2016,2016-09-26,0,,,,,,,Moderator,,,,
Donald Trump,"That was more than a mistake. That was done purposely. ok? That was not a mistake. That was done purposely. When you have your staff taking the Fifth Amendment, taking the Fifth so theyre not prosecuted, when you have the man that set up the illegal server taking the Fifth, I think its disgraceful. And believe me, this country thinks its— really thinks its disgraceful, also. As far as my tax returns, you dont learn that much from tax returns. That I can tell you. You learn a lot from financial disclosure. And you should go down and take a look at that. The other thing, Im extremely underleveraged. The report that said $650— which, by the way, a lot of friends of mine that know my business say, boy, thats really not a lot of money. Its not a lot of money relative to what I had. The buildings that were in question, they said in the same report, which was— actually, it wasnt even a bad story, to be honest with you, but the buildings are worth $3. 9 billion. And the $650 isnt even on that. But its not $650. Its much less than that. But I could give you a list of banks, I would— if that would help you, I would give you a list of banks. These are very fine institutions, very fine banks. I could do that very quickly. I am very underleveraged. I have a great company. I have a tremendous income. And the reason I say that is not in a braggadocios way. Its because its about time that this country had somebody running it that has an idea about money. When we have $20 trillion in debt, and our countrys a mess, you know, its one thing to have $20 trillion in debt and our roads are good and our bridges are good and everythings in great shape, our airports. Our airports are like from a third world country. You land at LaGuardia, you land at Kennedy, you land at LAX, you land at Newark, and you come in from Dubai and Qatar and you see these incredible— you come in from China, you see these incredible airports, and you land— weve become a third world country. So the worst of all things has happened. We owe $20 trillion, and were a mess. We havent even started. And weve spent $6 trillion in the Middle East, according to a report that I just saw. Whether its 6 or 5, but it looks like its 6, $6 trillion in the Middle East, we could have rebuilt our country twice. And its really a shame. And its politicians like Secretary Clinton that have caused this problem. Our country has tremendous problems. Were a debtor nation. Were a serious debtor nation. And we have a country that needs new roads, new tunnels, new bridges, new airports, new schools, new hospitals. And we dont have the money, because its been squandered on so many of your ideas.",Pres,2016,2016-09-26,1,,,,,,,Republican,,,,1.0
Lester Holt,Well let you respond and well move on to the next segment.,Pres,2016,2016-09-26,0,,,,,,,Moderator,,,,
Hillary Clinton,And maybe because you havent paid any federal income tax for a lot of years. [applause] And the other thing I think is important…,Pres,2016,2016-09-26,1,,,,,,,Democratic,,,,0.0
Donald Trump,"It would be squandered, too, believe me.",Pres,2016,2016-09-26,1,,,,,,,Republican,,,,1.0
Hillary Clinton,"… is if your— if your main claim to be president of the United States is your business, then I think we should talk about that. You know, your campaign manager said that you built a lot of businesses on the backs of little guys. And, indeed, I have met a lot of the people who were stiffed by you and your businesses, Donald. Ive met dishwashers, painters, architects, glass installers, marble installers, drapery installers, like my dad was, who you refused to pay when they finished the work that you asked them to do. We have an architect in the audience who designed one of your clubhouses at one of your golf courses. Its a beautiful facility. It immediately was put to use. And you wouldnt pay what the man needed to be paid, what he was charging you to do…",Pres,2016,2016-09-26,1,,,,,,,Democratic,,,,0.0
Donald Trump,Maybe he didnt do a good job and I was unsatisfied with his work…,Pres,2016,2016-09-26,1,,,,,,,Republican,,,,1.0
Hillary Clinton,"Well, to…",Pres,2016,2016-09-26,1,,,,,,,Democratic,,,,0.0
Donald Trump,"Which our country should do, too.",Pres,2016,2016-09-26,1,,,,,,,Republican,,,,1.0
Hillary Clinton,"Do the thousands of people that you have stiffed over the course of your business not deserve some kind of apology from someone who has taken their labor, taken the goods that they produced, and then refused to pay them? I can only say that Im certainly relieved that my late father never did business with you. He provided a good middle- class life for us, but the people he worked for, he expected the bargain to be kept on both sides. And when we talk about your business, youve taken business bankruptcy six times. There are a lot of great businesspeople that have never taken bankruptcy once. You call yourself the King of Debt. You talk about leverage. You even at one time suggested that you would try to negotiate down the national debt of the United States.",Pres,2016,2016-09-26,1,,,,,,,Democratic,,,,0.0
Donald Trump,Wrong. Wrong.,Pres,2016,2016-09-26,1,,,,,,,Republican,,,,1.0
