speaker,text,type,election_year,date,candidate,qud,question,similarity_cls,similarity_max,similarity_mean,similarity_sbert
Donald Trump,"I do want to say that I was just endorsed— and more are coming next week— it will be over 200 admirals, many of them here— admirals and generals endorsed me to lead this country. That just happened, and many more are coming. And Im very proud of it. In addition, I was just endorsed by ICE. Theyve never endorsed anybody before on immigration. I was just endorsed by ICE. I was just recently endorsed— 16, 500 Border Patrol agents. So when Secretary Clinton talks about this, I mean, Ill take the admirals and Ill take the generals any day over the political hacks that I see that have led our country so brilliantly over the last 10 years with their knowledge. ok? Because look at the mess that were in. Look at the mess that were in. As far as the cyber, I agree to parts of what Secretary Clinton said. We should be better than anybody else, and perhaps were not. I dont think anybody knows it was Russia that broke into the DNC. Shes saying Russia, Russia, Russia, but I dont— maybe it was. I mean, it could be Russia, but it could also be China. It could also be lots of other people. It also could be somebody sitting on their bed that weighs 400 pounds, ok? You dont know who broke in to DNC. But what did we learn with DNC? We learned that Bernie Sanders was taken advantage of by your people, by Debbie Wasserman Schultz. Look what happened to her. But Bernie Sanders was taken advantage of. Thats what we learned. Now, whether that was Russia, whether that was China, whether it was another country, we dont know, because the truth is, under President Obama weve lost control of things that we used to have control over. We came in with the Internet, we came up with the Internet, and I think Secretary Clinton and myself would agree very much, when you look at what ISIS is doing with the Internet, theyre beating us at our own game. ISIS. So we have to get very, very tough on cyber and cyber warfare. It is— it is a huge problem. I have a son. Hes 10 years old. He has computers. He is so good with these computers, its unbelievable. The security aspect of cyber is very, very tough. And maybe its hardly doable. But I will say, we are not doing the job we should be doing. But thats true throughout our whole governmental society. We have so many things that we have to do better, Lester, and certainly cyber is one of them.",Pres,2016,2016-09-26,1,"What are the key national security challenges the United States faces, particularly regarding military endorsements and cyber threats?","Our next segment is called “Securing America. ” We want to start with a 21st century war happening every day in this country. Our institutions are under cyber attack, and our secrets are being stolen. So my question is, whos behind it? And how do we fight it?",0.8517022,0.9278177,0.80354327,0.5265616
Donald Trump,"Well, first I have to say one thing, very important. Secretary Clinton is talking about taking out ISIS. “We will take out ISIS. ” Well, President Obama and Secretary Clinton created a vacuum the way they got out of Iraq, because they got out— what, they shouldnt have been in, but once they got in, the way they got out was a disaster. And ISIS was formed. So she talks about taking them out. Shes been doing it a long time. Shes been trying to take them out for a long time. But they wouldnt have even been formed if they left some troops behind, like 10, 000 or maybe something more than that. And then you wouldnt have had them. Or, as Ive been saying for a long time, and I think youll agree, because I said it to you once, had we taken the oil— and we should have taken the oil— ISIS would not have been able to form either, because the oil was their primary source of income. And now they have the oil all over the place, including the oil— a lot of the oil in Libya, which was another one of her disasters.",Pres,2016,2016-09-26,1,What are the criticisms regarding the previous administration's handling of ISIS and the situation in Iraq?,"You mention ISIS, and we think of ISIS certainly as over there, but there are American citizens who have been inspired to commit acts of terror on American soil, the latest incident, of course, the bombings we just saw in New York and New Jersey, the knife attack at a mall in Minnesota, in the last year, deadly attacks in San Bernardino and Orlando. Ill ask this to both of you. Tell us specifically how you would prevent homegrown attacks by American citizens, Mr. Trump?",0.8420649,0.9243923,0.7827544,0.34160322
Donald Trump,"Well, I have to say that, you know, for what Secretary Clinton was saying about nuclear with Russia, shes very cavalier in the way she talks about various countries. But Russia has been expanding their— they have a much newer capability than we do. We have not been updating from the new standpoint. I looked the other night. I was seeing B- 52s, theyre old enough that your father, your grandfather could be flying them. We are not— we are not keeping up with other countries. I would like everybody to end it, just get rid of it. But I would certainly not do first strike. I think that once the nuclear alternative happens, its over. At the same time, we have to be prepared. I cant take anything off the table. Because you look at some of these countries, you look at North Korea, were doing nothing there. China should solve that problem for us. China should go into North Korea. China is totally powerful as it relates to North Korea. And by the way, another one powerful is the worst deal I think Ive ever seen negotiated that you started is the Iran deal. Iran is one of their biggest trading partners. Iran has power over North Korea. And when they made that horrible deal with Iran, they should have included the fact that they do something with respect to North Korea. And they should have done something with respect to Yemen and all these other places. And when asked to Secretary Kerry, why didnt you do that? Why didnt you add other things into the deal? One of the great giveaways of all time, of all time, including $400 million in cash. Nobodys ever seen that before. That turned out to be wrong. It was actually $1. 7 billion in cash, obviously, I guess for the hostages. It certainly looks that way. So you say to yourself, why didnt they make the right deal? This is one of the worst deals ever made by any country in history. The deal with Iran will lead to nuclear problems. All they have to do is sit back 10 years, and they dont have to do much.",Pres,2016,2016-09-26,1,"What are the implications of the current U.S. nuclear strategy and international agreements, particularly regarding Russia, Iran, and North Korea?","Which leads to my next question, as we enter our last segment here on the, still on the subject of securing America. On nuclear weapons, President Obama reportedly considered changing the nations longstanding policy on first use. Do you support the current policy?",0.877658,0.93073636,0.766364,0.49245822
Hillary Clinton,"Well, let me— let me start by saying, words matter. Words matter when you run for president. And they really matter when you are president. And I want to reassure our allies in Japan and South Korea and elsewhere that we have mutual defense treaties and we will honor them. It is essential that Americas word be good. And so I know that this campaign has caused some questioning and some worries on the part of many leaders across the globe. Ive talked with a number of them. But I want to— on behalf of myself, and I think on behalf of a majority of the American people, say that, you know, our word is good. Its also important that we look at the entire global situation. Theres no doubt that we have other problems with Iran. But personally, Id rather deal with the other problems having put that lid on their nuclear program than still to be facing that. And Donald never tells you what he would do. Would he have started a war? Would he have bombed Iran? If hes going to criticize a deal that has been very successful in giving us access to Iranian facilities that we never had before, then he should tell us what his alternative would be. But its like his plan to defeat ISIS. He says its a secret plan, but the only secret is that he has no plan. So we need to be more precise in how we talk about these issues. People around the word follow our presidential campaigns so closely, trying to get hints about what we will do. Can they rely on us? Are we going to lead the world with strength and in accordance with our values? Thats what I intend to do. I intend to be a leader of our country that people can count on, both here at home and around the world, to make decisions that will further peace and prosperity, but also stand up to bullies, whether theyre abroad or at home. We cannot let those who would try to destabilize the world to interfere with American interests and security…",Pres,2016,2016-09-26,1,How will you reassure allies and affirm the United States' commitment to international agreements while addressing global security concerns?,"Which leads to my next question, as we enter our last segment here on the, still on the subject of securing America. On nuclear weapons, President Obama reportedly considered changing the nations longstanding policy on first use. Do you support the current policy?",0.88450766,0.9156443,0.74854946,0.43240878
Hillary Clinton,"Well, I support our democracy. And sometimes you win, sometimes you lose. But I certainly will support the outcome of this election. And I know Donalds trying very hard to plant doubts about it, but I hope the people out there understand; This elections really up to you. Its not about us so much as it is about you and your families and the kind of country and future you want. So I sure hope you will get out and vote as though your future depended on it, because I think it does.",Pres,2016,2016-09-26,1,Why is it important for individuals to participate in the electoral process and support the outcome of elections?,"One of you will not win this election. So my final question to you tonight, are you willing to accept the outcome as the will of the voters? Secretary Clinton?",0.82737184,0.9096378,0.73966545,0.29045045
Donald Trump,"I want to make America great again. We are a nation that is seriously troubled. Were losing our jobs. People are pouring into our country. The other day, we were deporting 800 people. And perhaps they passed the wrong button, they pressed the wrong button, or perhaps worse than that, it was corruption, but these people that we were going to deport for good reason ended up becoming citizens. Ended up becoming citizens. And it was 800. And now it turns out it might be 1, 800, and they dont even know.",Pres,2016,2016-09-26,1,What issues need to be addressed to improve the current immigration system and protect American jobs?,"One of you will not win this election. So my final question to you tonight, are you willing to accept the outcome as the will of the voters? Secretary Clinton?",0.83246124,0.90853834,0.72933733,0.13170828
