speaker,text,type,election_year,date,candidate,qud,question,similarity_cls,similarity_max,similarity_mean,similarity_sbert,party,question_clean,qud_answer_fit,qud_question_fit
Chris Wallace,"Good evening. From the Health Education Campus of Case Western Reserve University and the Cleveland Clinic I'm Chris Wallace of Fox News and I welcome you to the first of the 2020 presidential debates between President Donald J. Trump and former Vice President Joe Biden. This debate is sponsored by the Commission on Presidential Debates. The commission has designed the format, six roughly 15- minute segments with two- minute answers from each candidate to the first question, then open discussion for the rest of each segment. Both campaigns have agreed to these rules. For the record, I decided the topics and the questions in each topic. I can assure you none of the questions has been shared with the commission or the two candidates. This debate is being conducted under health and safety protocols designed by the Cleveland Clinic, which is serving as the health security adviser to the commission for all four debates. As a precaution, both campaigns have agreed the candidates will not shake hands at the beginning of tonight's debate. The audience here in the hall has promised to remain silent. No cheers, no boos, or other interruptions so we, and more importantly you, can focus on what the candidates have to say. No noise, except right now as we welcome the Republican nominee, President Trump, and the Democratic nominee, Vice President Biden. ",Pres,2020,2020-09-29,0,,,,,,,Moderator,,,
Joe Biden,"How are you doing, man? ",Pres,2020,2020-09-29,1,,,,,,,Democratic,,,
Donald Trump,How are you doing ?,Pres,2020,2020-09-29,1,,,,,,,Republican,,,
Joe Biden,I'm well.,Pres,2020,2020-09-29,1,,,,,,,Democratic,,,
Chris Wallace,"Gentlemen, a lot of people have been waiting for this night. So let's get going. Our first subject is the Supreme Court. President Trump, you nominated Amy Coney Barrett over the weekend to succeed the late Ruth Bader Ginsburg on the court. You say the Constitution is clear about your obligation and the Senate's to consider a nominee to the court. Vice President Biden, you say that this is an effort by the president and Republicans to jam through an appointment and what you call an abuse of power. My first question to both of you tonight, why are you right and make the argument you make, and your opponent wrong? And where do you think a Justice Barrett would take the court? President Trump, on the first segment you go first. Two minutes. ",Pres,2020,2020-09-29,0,,,,,,,Moderator,,,
Donald Trump,"Thank you very much, Chris. I will tell you very simply we won the election. Elections have consequences. We have the Senate, we have the White House and we have a phenomenal nominee respected by all; top, top academic. Good in every way. Good in every way. In fact, some of her biggest endorsers are very liberal people from Notre Dame and other places. So I think she's going to be fantastic. We have plenty of time. Even if we did it after the election itself, I have a lot of time after the election, as you know. So I think that she will be outstanding. She's going to be as good as anybody that has served on that court. We really feel that. We have a professor at Notre Dame, highly respected by all; said she's the single greatest student he's ever had. He's been a professor for a long time at a great school. And we just - - we won the election and therefore we have the right to choose her, and very few people knowingly would say otherwise. And by the way, the Democrats, they wouldn't even think about not doing it. If they had - - the only difference is they'd try and do it faster. There's no way they would give it up. They had Merrick Garland, but the problem is they didn't have the election. So they were stopped. And probably that would happen in reverse also. Definitely it would happen in reverse. So we won the election and we have the right to do it, Chris. ",Pres,2020,2020-09-29,1,What justification does the speaker provide for their right to nominate a Supreme Court candidate following their election victory?,"Our first subject is the Supreme Court. President Trump, you nominated Amy Coney Barrett over the weekend to succeed the late Ruth Bader Ginsburg on the court. You say the Constitution is clear about your obligation and the Senate's to consider a nominee to the court. Vice President Biden, you say that this is an effort by the president and Republicans to jam through an appointment and what you call an abuse of power. My first question to both of you tonight, why are you right and make the argument you make, and your opponent wrong? And where do you think a Justice Barrett would take the court?",0.9051448107,0.930631876,0.7773368359,0.5983941555,Republican,"Why are you right in your arguments regarding the Supreme Court nomination, and where do you think a Justice Barrett would take the court?",3,3
Chris Wallace,"President Trump, thank you. Same question to you, Vice President Biden. You have two minutes. ",Pres,2020,2020-09-29,0,,,,,,,Moderator,,,
Joe Biden,"Well, first of all, thank you for doing this and looking forward to this, Mr. President. ",Pres,2020,2020-09-29,1,,,,,,,Democratic,,,
Donald Trump,"Thank you, Joe. ",Pres,2020,2020-09-29,1,,,,,,,Republican,,,
Joe Biden,"I - - the American people have a right to have a say in who the Supreme Court nominee is. And that say occurs when they vote for a - - United States senators and when they vote for the president of United States. They're not going to get that chance now because we're in the middle of an election already. The election has already started. Tens of thousands of people have already voted, and so the thing that should happen is we should wait. We should wait and see what the outcome of this election is. Because that's the only way the American people get to express their view is by who they elect as president and who they elect as vice president. Now, what's at stake here is the president has made it clear he wants to get rid of the Affordable Care Act. He's been running on that, he ran on that, and he's been governing on that. He's in the Supreme Court right now trying to get rid of the Affordable Care Act, which will strip 20 million people from having insurance - - health insurance now, if it - - if they - - if it goes into court. And - - and the justice - - and I have nothing - - I'm not opposed to the justice, as she seems like a very fine person. But she's written before she went into the bench - - which is her right - - that she thinks that the Affordable Care Act is not constitutional. The other thing that's on the court - - and if it's struck down, what happens. Women's rights are fundamentally changed. Once again, a woman could be held - - pay more money because she has a pre- existing condition, a pregnancy. ",Pres,2020,2020-09-29,1,Why should the appointment of a Supreme Court nominee be postponed until after the election?,"Our first subject is the Supreme Court. President Trump, you nominated Amy Coney Barrett over the weekend to succeed the late Ruth Bader Ginsburg on the court. You say the Constitution is clear about your obligation and the Senate's to consider a nominee to the court. Vice President Biden, you say that this is an effort by the president and Republicans to jam through an appointment and what you call an abuse of power. My first question to both of you tonight, why are you right and make the argument you make, and your opponent wrong? And where do you think a Justice Barrett would take the court?",0.9020672441,0.9184020162,0.771674037,0.516242981,Democratic,"Why are you right in your argument regarding the nomination of Amy Coney Barrett, and where do you think a Justice Barrett would take the court?",3,3
Joe Biden,"We're able - - they're able to charge women more for the same exact procedure a man did - - gets. And that ended when we, in fact, passed the Affordable Care Act. And there's 100 million people who have pre- existing conditions, and they'll be taken away as well, those pre- existing conditions; insurance companies are going to love this. And so it's just not appropriate to do this before this election. If he wins the election and the Senate is Democrat or Republican, then he goes forward. If not, we should wait until February. ",Pres,2020,2020-09-29,1,,,,,,,Democratic,,,
Chris Wallace,All right .,Pres,2020,2020-09-29,0,,,,,,,Moderator,,,
Donald Trump,"There aren't 100 million people with pre- existing condition. As far as say is concerned, the people already had their say. They - - ok. Justice Ginsburg said very powerfully, very strongly, at some point, 10 years ago or so, she said a president and the Senate is elected for period of time but a president is elected for four years. We're not elected for three years. I'm not elected for three years. So, we have the Senate, we have president - - ",Pres,2020,2020-09-29,1,,,,,,,Republican,,,
Joe Biden,He's elected to the next election.,Pres,2020,2020-09-29,1,,,,,,,Democratic,,,
Donald Trump,"- - during that period of time, during that period of time, we have an opening. I'm not elected for three years, I'm elected for four years. And 100 million people - - ",Pres,2020,2020-09-29,1,,,,,,,Republican,,,
Joe Biden,The election has already started - -,Pres,2020,2020-09-29,1,,,,,,,Democratic,,,
Donald Trump,"Joe, the 100 million people is totally wrong. I don't know where you got that number. The bigger problem that you have is that you're going to extinguish 180 million people with their private health care that they're very happy with. ",Pres,2020,2020-09-29,1,,,,,,,Republican,,,
Joe Biden,That's simply not true.,Pres,2020,2020-09-29,1,,,,,,,Democratic,,,
Donald Trump,"Well, you're simply going to socialist - - you're going to socialist - - ",Pres,2020,2020-09-29,1,,,,,,,Republican,,,
Chris Wallace,"We're now into - - gentlemen, we're now into open discussion. ",Pres,2020,2020-09-29,0,,,,,,,Moderator,,,
Joe Biden,Open discussion.,Pres,2020,2020-09-29,1,,,,,,,Democratic,,,
Chris Wallace,"Open discussion, yes, I agree. Go ahead, Vice President Biden. ",Pres,2020,2020-09-29,0,,,,,,,Moderator,,,
Joe Biden,"Number one, he knows that - - what I proposed. What I proposed is that we expand Obamacare and we increase it. We do not wipe any - - and one of the big debates we had with 23 of my colleagues trying to win back the nomination that I won, were saying that Biden wanted to allow people to have private insurance still. They can, they do, they will under my proposal. ",Pres,2020,2020-09-29,1,,,,,,,Democratic,,,
Donald Trump,That's not what you've said and it's not what your party has said.,Pres,2020,2020-09-29,1,,,,,,,Republican,,,
Joe Biden,That is simply a lie.,Pres,2020,2020-09-29,1,,,,,,,Democratic,,,
Donald Trump,Your party doesn't say it. Your party wants to go socialist medicine.,Pres,2020,2020-09-29,1,,,,,,,Republican,,,
Joe Biden,My party is me.,Pres,2020,2020-09-29,1,,,,,,,Democratic,,,
Donald Trump,And socialist health care.,Pres,2020,2020-09-29,1,,,,,,,Republican,,,
Joe Biden,"Right now, I am the Democratic Party. ",Pres,2020,2020-09-29,1,,,,,,,Democratic,,,
Donald Trump,"And they're going to dominate you, Joe, you know that. ",Pres,2020,2020-09-29,1,,,,,,,Republican,,,
Joe Biden,I am the Democratic Party right now. The platform of the Democratic Party - -,Pres,2020,2020-09-29,1,,,,,,,Democratic,,,
Donald Trump,Not according to Harris.,Pres,2020,2020-09-29,1,,,,,,,Republican,,,
Joe Biden,"- - is what I, in fact, approved of. What I approved of. Now here's the deal; the deal is that it's going to wipe out pre- existing conditions. And by the way, the 20 - - the 200 million - - the 200, 000 people that have died on his watch, they're - - how many of those and - - that have survived? Well, 7 million people have contracted COVID. What does it mean for them going forward if you strike down the Affordable Care Act? ",Pres,2020,2020-09-29,1,,,,,,,Democratic,,,
Donald Trump,"Joe, you've had 308, 000 military people dying because you couldn't provide them proper health care in the military. So don't tell me about this. ",Pres,2020,2020-09-29,1,,,,,,,Republican,,,
Joe Biden,I'm happy to talk about this.,Pres,2020,2020-09-29,1,,,,,,,Democratic,,,
Donald Trump,"And if you were here, it wouldn't be 200. It would be 2 million people because you were very late on the draw. ",Pres,2020,2020-09-29,1,,,,,,,Republican,,,
Joe Biden,Late on the draw.,Pres,2020,2020-09-29,1,,,,,,,Democratic,,,
Donald Trump,"You didn't want me to ban China, which was heavily infected. You didn't want me to ban Europe which was heavily infected. ",Pres,2020,2020-09-29,1,,,,,,,Republican,,,
Chris Wallace,"All right, gentlemen - - ",Pres,2020,2020-09-29,0,,,,,,,Moderator,,,
Donald Trump,"You would have been much later, Joe. Much later. ",Pres,2020,2020-09-29,1,,,,,,,Republican,,,
Chris Wallace,"Mr. President, Mr. President - - ",Pres,2020,2020-09-29,0,,,,,,,Moderator,,,
Donald Trump,We're talking about 2 million people.,Pres,2020,2020-09-29,1,,,,,,,Republican,,,
Joe Biden,You're not going to - -,Pres,2020,2020-09-29,1,,,,,,,Democratic,,,
Chris Wallace,"Mr. President, as a moderator, we are going to talk about COVID in the next segment but go ahead. ",Pres,2020,2020-09-29,0,,,,,,,Moderator,,,
Joe Biden,"Let me finish. The point is that the president also is opposed to Roe v. Wade. That's on the ballot as well, in the court, in the court. And so, that's also at stake right now. And so, the election is already begun. ",Pres,2020,2020-09-29,1,,,,,,,Democratic,,,
Donald Trump,You don't know what's on the ballot. Why is it on the ballot?,Pres,2020,2020-09-29,1,,,,,,,Republican,,,
Joe Biden,Because - - because you've said - -,Pres,2020,2020-09-29,1,,,,,,,Democratic,,,
Donald Trump,Why is it on the ballot? It's not on the ballot.,Pres,2020,2020-09-29,1,,,,,,,Republican,,,
Joe Biden,"It's on the ballot, in the court. ",Pres,2020,2020-09-29,1,,,,,,,Democratic,,,
Donald Trump,I don't think so.,Pres,2020,2020-09-29,1,,,,,,,Republican,,,
Joe Biden,In the court. Well - -,Pres,2020,2020-09-29,1,,,,,,,Democratic,,,
Donald Trump,There's nothing happening there.,Pres,2020,2020-09-29,1,,,,,,,Republican,,,
Joe Biden,"Donald, would you just (inaudible) - - ",Pres,2020,2020-09-29,1,,,,,,,Democratic,,,
Donald Trump,And you don't know her view on Roe v. Wade. You don't know her view.,Pres,2020,2020-09-29,1,,,,,,,Republican,,,
Joe Biden,I don't know - -,Pres,2020,2020-09-29,1,,,,,,,Democratic,,,
Chris Wallace,"Well, all right, let's - - all right. Let's talk - - I would - - we've got a lot to unpack here, gentlemen. We got a lot of time. So - - ",Pres,2020,2020-09-29,0,,,,,,,Moderator,,,
Chris Wallace,"On health care, and then we'll come back to Roe v. Wade. ",Pres,2020,2020-09-29,0,,,,,,,Moderator,,,
Joe Biden,All right.,Pres,2020,2020-09-29,1,,,,,,,Democratic,,,
Chris Wallace,"Mr. President, the Supreme Court will hear a case a week after the election in which the Trump administration, along with 18 state attorneys general are seeking to overturn - - ",Pres,2020,2020-09-29,0,,,,,,,Moderator,,,
Donald Trump,That's right.,Pres,2020,2020-09-29,1,,,,,,,Republican,,,
Chris Wallace,"- - Obamacare, to end Obamacare. You had spent the last - - ",Pres,2020,2020-09-29,0,,,,,,,Moderator,,,
Donald Trump,Because they want to give good health care - -,Pres,2020,2020-09-29,1,,,,,,,Republican,,,
Chris Wallace,"If I may ask that question, sir. ",Pres,2020,2020-09-29,0,,,,,,,Moderator,,,
Donald Trump,Go ahead.,Pres,2020,2020-09-29,1,,,,,,,Republican,,,
Joe Biden,Good health care.,Pres,2020,2020-09-29,1,,,,,,,Democratic,,,
Chris Wallace,"Over the last four years, you have promised to repeal and replace Obamacare but you have never in these four years come up with a plan, a comprehensive plan - - ",Pres,2020,2020-09-29,0,,,,,,,Moderator,,,
Donald Trump,"Of course, I have. ",Pres,2020,2020-09-29,1,,,,,,,Republican,,,
Chris Wallace,- - to replace Obamacare.,Pres,2020,2020-09-29,0,,,,,,,Moderator,,,
Donald Trump,"Of course, I have. ",Pres,2020,2020-09-29,1,,,,,,,Republican,,,
Chris Wallace,"Well, I'll give you an - - ",Pres,2020,2020-09-29,0,,,,,,,Moderator,,,
Donald Trump,I got rid of the individual mandate.,Pres,2020,2020-09-29,1,,,,,,,Republican,,,
Chris Wallace,"- - when I finish, I'm going to give you an opportunity - - ",Pres,2020,2020-09-29,0,,,,,,,Moderator,,,
Donald Trump,Excuse me. I got rid of the individual mandate which was a big chunk of Obama - -,Pres,2020,2020-09-29,1,,,,,,,Republican,,,
Chris Wallace,That is not a comprehensive plan.,Pres,2020,2020-09-29,0,,,,,,,Moderator,,,
Donald Trump,That is absolutely a big thing. That was the worst part of Obamacare.,Pres,2020,2020-09-29,1,,,,,,,Republican,,,
Chris Wallace,I didn't ask - -,Pres,2020,2020-09-29,0,,,,,,,Moderator,,,
Donald Trump,"Chris, that was the worst part of Obama - - ",Pres,2020,2020-09-29,1,,,,,,,Republican,,,
Chris Wallace,"Sir, you're debating him, not me. Let me ask my question - - ",Pres,2020,2020-09-29,0,,,,,,,Moderator,,,
Donald Trump,"Well, I'll ask Joe. ",Pres,2020,2020-09-29,1,,,,,,,Republican,,,
Chris Wallace,No - -,Pres,2020,2020-09-29,0,,,,,,,Moderator,,,
Donald Trump,The individual mandate was the most unpopular aspect of Obamacare. I got rid of it. And we will protect people with preexisting condition.,Pres,2020,2020-09-29,1,,,,,,,Republican,,,
Chris Wallace,I'm the moderator of this debate and I would like you to let me ask my question and then you can answer your - -,Pres,2020,2020-09-29,0,,,,,,,Moderator,,,
Donald Trump,Go ahead.,Pres,2020,2020-09-29,1,,,,,,,Republican,,,
Chris Wallace,"You, in the course of these four years have never come up with a comprehensive plan to replace Obamacare and just this last Thursday, you signed a largely symbolic executive order to protect people with pre- existing conditions five days before this debate. So my question, sir, is what is the Trump health care plan? ",Pres,2020,2020-09-29,0,,,,,,,Moderator,,,
Donald Trump,"All right. Well, first of all, I guess I'm debating you, not him. But that's ok. I'm not surprise. Let me just tell you something, that there's nothing symbolic. I'm cutting drug prices. I'm going with favored nations which no president has the courage to do because you're going against big pharma. Drug prices will be coming down 80 or 90%. You could have done it during your 47- year period in government, but you didn't do it. Nobody has done it. So we are cutting health care ",Pres,2020,2020-09-29,1,How do you plan to reduce drug prices and what specific measures will you implement to achieve this?,"You, in the course of these four years have never come up with a comprehensive plan to replace Obamacare and just this last Thursday, you signed a largely symbolic executive order to protect people with pre- existing conditions five days before this debate. So my question, sir, is what is the Trump health care plan? ",0.8722455502,0.9049085379,0.7567427158,0.4188629985,Republican,What is the Trump health care plan?,3,3
Chris Wallace,What about pre- existing conditions?,Pres,2020,2020-09-29,0,,,,,,,Moderator,,,
Donald Trump,All of the things that we've done,Pres,2020,2020-09-29,1,,,,,,,Republican,,,
Donald Trump,"I'll give you an example, insulin. It's going to - - it was destroying families, destroying people, the cost. I am getting it for so cheap, it's like water, you want to know the truth. So cheap. Take a look at all of the drugs that - - what we're doing. Prescription drug prices, we're going to allow our governors now to go to other countries to buy drugs because they pay just a tiny fraction that we do. ",Pres,2020,2020-09-29,1,,,,,,,Republican,,,
Chris Wallace,"As I say, this is open discussion. Let me ask you about ",Pres,2020,2020-09-29,0,,,,,,,Moderator,,,
Donald Trump,This is big stuff.,Pres,2020,2020-09-29,1,,,,,,,Republican,,,
Chris Wallace,"Sir, you'll be happy, I'm about to pick up on one of your points to ask the vice president, which is, he points out that you would like to add a public option to Obamacare, and the argument that he makes and other Republicans make is that that is going to end private insurance and will ",Pres,2020,2020-09-29,0,,,,,,,Moderator,,,
Joe Biden,It is not. Sorry.,Pres,2020,2020-09-29,1,,,,,,,Democratic,,,
Chris Wallace,If I can ask you the question. It will end,Pres,2020,2020-09-29,0,,,,,,,Moderator,,,
Donald Trump,"Not what your party says, by the way. ",Pres,2020,2020-09-29,1,,,,,,,Republican,,,
Chris Wallace,It will end private insurance and create a government takeover of health care.,Pres,2020,2020-09-29,0,,,,,,,Moderator,,,
Joe Biden,"It does not. It's only for those people who are so poor they qualify for Medicaid, they can get that free in most states except governors who want to deny people who are poor Medicaid. Anyone who qualifies for Medicare - - excuse me, Medicaid would automatically be enrolled in the public option. The vast majority of the American people would still not be in that option. Number one. Number two ",Pres,2020,2020-09-29,1,,,,,,,Democratic,,,
Donald Trump,"Joe, you agreed with Bernie Sanders's far left on the manifesto, we call it. ",Pres,2020,2020-09-29,1,,,,,,,Republican,,,
Joe Biden,Manifesto? Look,Pres,2020,2020-09-29,1,,,,,,,Democratic,,,
Donald Trump,And that gives you socialized medicine.,Pres,2020,2020-09-29,1,,,,,,,Republican,,,
Joe Biden,"Look, hey, I'm not going to listen to him. The fact of the matter is I beat Bernie Sanders ",Pres,2020,2020-09-29,1,,,,,,,Democratic,,,
Donald Trump,Not by much.,Pres,2020,2020-09-29,1,,,,,,,Republican,,,
Joe Biden,"I beat him by a whole hell of a lot. I'm here standing facing you, old buddy. ",Pres,2020,2020-09-29,1,,,,,,,Democratic,,,
Donald Trump,"If "" Pocahontas"" would've left two days early, you would've lost every primary. ",Pres,2020,2020-09-29,1,,,,,,,Republican,,,
Joe Biden,All he knows how to do is hurt,Pres,2020,2020-09-29,1,,,,,,,Democratic,,,
Donald Trump,"On Super Tuesday, you got very lucky. ",Pres,2020,2020-09-29,1,,,,,,,Republican,,,
Joe Biden,"Look, here's the deal. I got very lucky, I'm going to get very lucky tonight as well. And tonight I'm going to make sure because here's the deal. ",Pres,2020,2020-09-29,1,,,,,,,Democratic,,,
Donald Trump,With what?,Pres,2020,2020-09-29,1,,,,,,,Republican,,,
Joe Biden,Here's the deal. The fact is that everything he is saying so far is simply a lie. I'm not here to call out his lies. Everybody knows he's a liar.,Pres,2020,2020-09-29,1,,,,,,,Democratic,,,
Joe Biden,I just want to make sure,Pres,2020,2020-09-29,1,,,,,,,Democratic,,,
Donald Trump,"  last in your class, not first in your class. ",Pres,2020,2020-09-29,1,,,,,,,Republican,,,
Joe Biden,God. I want to make sure,Pres,2020,2020-09-29,1,,,,,,,Democratic,,,
Chris Wallace,"Mr. President, can you let him finish, sir? ",Pres,2020,2020-09-29,0,,,,,,,Moderator,,,
Joe Biden,"No, he doesn't know how to do that. He has ",Pres,2020,2020-09-29,1,,,,,,,Democratic,,,
Donald Trump,"You'd be surprised. You'd be surprised. Go ahead, Joe ",Pres,2020,2020-09-29,1,,,,,,,Republican,,,
Joe Biden,"The wrong guy, the wrong night, at the wrong time. ",Pres,2020,2020-09-29,1,,,,,,,Democratic,,,
Donald Trump,"Listen, you agreed with Bernie Sanders ",Pres,2020,2020-09-29,1,,,,,,,Republican,,,
Joe Biden,Here's the deal,Pres,2020,2020-09-29,1,,,,,,,Democratic,,,
Joe Biden,"There is no manifesto, number one. ",Pres,2020,2020-09-29,1,,,,,,,Democratic,,,
Chris Wallace,"Please let him speak, Mr. President. ",Pres,2020,2020-09-29,0,,,,,,,Moderator,,,
Joe Biden,Number two,Pres,2020,2020-09-29,1,,,,,,,Democratic,,,
Donald Trump,You just lost the left.,Pres,2020,2020-09-29,1,,,,,,,Republican,,,
Joe Biden,Number two,Pres,2020,2020-09-29,1,,,,,,,Democratic,,,
Donald Trump,You just lost the left. You agreed with Bernie Sanders on a plan that's absolutely,Pres,2020,2020-09-29,1,,,,,,,Republican,,,
Donald Trump,socialized medicine.,Pres,2020,2020-09-29,1,,,,,,,Republican,,,
Chris Wallace,Mr. President,Pres,2020,2020-09-29,0,,,,,,,Moderator,,,
Joe Biden,"I'll tell you what, he is not for any help for people needing health care. Because his ",Pres,2020,2020-09-29,1,,,,,,,Democratic,,,
Donald Trump,"Who, Bernie? ",Pres,2020,2020-09-29,1,,,,,,,Republican,,,
Joe Biden,"Because he, in fact, already has cost 10 million people their health care that they had from their employers because of his recession, number one. Number two, there are 20 million people getting health care through Obamacare now that he wants to take it away. He won't ever look you in the eye and say that's what he wants to do, take it away. Number three ",Pres,2020,2020-09-29,1,,,,,,,Democratic,,,
Donald Trump,"No, I want to give them better health care at a much lower price because Obamacare is no good. ",Pres,2020,2020-09-29,1,,,,,,,Republican,,,
Joe Biden,He doesn't know how. He doesn't know how to do that.,Pres,2020,2020-09-29,1,,,,,,,Democratic,,,
Donald Trump,I've already fixed it.,Pres,2020,2020-09-29,1,,,,,,,Republican,,,
Joe Biden,He has never offered a plan.,Pres,2020,2020-09-29,1,,,,,,,Democratic,,,
Donald Trump,I've already fixed it to an extent.,Pres,2020,2020-09-29,1,,,,,,,Republican,,,
Joe Biden,He has never done a single thing.,Pres,2020,2020-09-29,1,,,,,,,Democratic,,,
Donald Trump,"  as you might know, but probably don't, Obamacare ",Pres,2020,2020-09-29,1,,,,,,,Republican,,,
Chris Wallace,"Gentlemen, you realize that you are both speaking at the same time. Let the president - - go ahead, sir. ",Pres,2020,2020-09-29,0,,,,,,,Moderator,,,
Donald Trump,"Obamacare is no good, we made it better. And I had a choice to make very early on. We took away the individual mandate. We guarantee pre- existing conditions ",Pres,2020,2020-09-29,1,,,,,,,Republican,,,
Joe Biden,Not true.,Pres,2020,2020-09-29,1,,,,,,,Democratic,,,
