speaker,text,type,election_year,date,candidate,qud,question,similarity_cls,similarity_max,similarity_mean,similarity_sbert,party,question_clean,qud_answer_fit,qud_question_fit
Donald Trump,"Wait a minute, Joe. Let me shut you down for a second, Joe, just for one second. We want to - - he wants to shut down the country. We just went through it. We had to because we didn't know anything about the disease. Now, we found that elderly people with heart problems and diabetes and different problems are very, very vulnerable. We learned a lot. Young children aren't, even younger people aren't - - we've learned a lot. But he wants to shut it down. More people will be hurt by continuing - - if you look at Pennsylvania - - if you look at certain states that have been shut down, they have Democrat governors all. One of the reasons they shut down is because they want to keep it shut down until after the election on November 3rd - - ",Pres,2020,2020-09-29,1,,,,,,,Republican,,,
Chris Wallace,I want to move onto another subject - -,Pres,2020,2020-09-29,0,,,,,,,Moderator,,,
Donald Trump,- - because it's a political thing.,Pres,2020,2020-09-29,1,,,,,,,Republican,,,
Chris Wallace,I want to move onto another subject - -,Pres,2020,2020-09-29,0,,,,,,,Moderator,,,
Joe Biden,I've got to respond to that.,Pres,2020,2020-09-29,1,,,,,,,Democratic,,,
Donald Trump,But those states - -,Pres,2020,2020-09-29,1,,,,,,,Republican,,,
Chris Wallace,I want to move - -,Pres,2020,2020-09-29,0,,,,,,,Moderator,,,
Donald Trump,Those states are not doing well that are shut down.,Pres,2020,2020-09-29,1,,,,,,,Republican,,,
Chris Wallace,"Gentlemen, I want to move onto another subject - - ",Pres,2020,2020-09-29,0,,,,,,,Moderator,,,
Joe Biden,I've got to respond to that.,Pres,2020,2020-09-29,1,,,,,,,Democratic,,,
Chris Wallace,- - which is masks.,Pres,2020,2020-09-29,0,,,,,,,Moderator,,,
Donald Trump,He wants to shut down the whole country - -,Pres,2020,2020-09-29,1,,,,,,,Republican,,,
Chris Wallace,"President Trump, you have begun to increasingly question the effectiveness of masks as a disease preventer. And in fact, recently you have cited the issue of - - of waiters touching their masks and touching plates. Are you questioning the efficacy of masks? ",Pres,2020,2020-09-29,0,,,,,,,Moderator,,,
Donald Trump,"No, I think that masks are ok. You have to understand, if you look - - I mean, I have a mask right here. I put a mask on, you know, when I think I need it. Tonight, as an example, everybody's had a test and you've had social distancing and all of the things that you have to, but - - ",Pres,2020,2020-09-29,1,What is your stance on the use of masks in specific situations?,"President Trump, you have begun to increasingly question the effectiveness of masks as a disease preventer. And in fact, recently you have cited the issue of - - of waiters touching their masks and touching plates. Are you questioning the efficacy of masks? ",0.9554023743,0.926848948,0.8375357389,0.8276643753,Republican,Are you questioning the efficacy of masks?,3,3
Joe Biden,Just like your rallies.,Pres,2020,2020-09-29,1,,,,,,,Democratic,,,
Donald Trump,"- - I wear masks when needed. When needed, I wear masks. ",Pres,2020,2020-09-29,1,,,,,,,Republican,,,
Chris Wallace,"ok, let me ask - - ",Pres,2020,2020-09-29,0,,,,,,,Moderator,,,
Donald Trump,"I don't have - - I don't wear masks like him. Every time you see him, he's got a mask. He could be speaking 200 feet away from them and he shows up with the biggest mask I've ever seen. I will say - - ",Pres,2020,2020-09-29,1,,,,,,,Republican,,,
Chris Wallace,Vice President - -,Pres,2020,2020-09-29,0,,,,,,,Moderator,,,
Donald Trump,- - I look  at like this  - -,Pres,2020,2020-09-29,1,,,,,,,Republican,,,
Chris Wallace,"- - Vice President Biden, go ahead, sir. ",Pres,2020,2020-09-29,0,,,,,,,Moderator,,,
Joe Biden,"Look, the way to open businesses is give them the wherewithal to be able to open. We provide money that Congress - - ",Pres,2020,2020-09-29,1,,,,,,,Democratic,,,
Chris Wallace,"But I was asking you, sir, about masks. ",Pres,2020,2020-09-29,0,,,,,,,Moderator,,,
Joe Biden,"Well, masks - - masks make a big difference. His own head of the CDC said if we just wore a mask between now - - if they're - - everybody wore a mask and social distanced between now and January, we'd probably save up to 100, 000 lives. It matters. It matters. ",Pres,2020,2020-09-29,1,,,,,,,Democratic,,,
Donald Trump,And they've also said the opposite. They've also said the opposite.,Pres,2020,2020-09-29,1,,,,,,,Republican,,,
Joe Biden,And no - - no serious person said the opposite. No serious person - -,Pres,2020,2020-09-29,1,,,,,,,Democratic,,,
Donald Trump,So we'll look at - - look at Dr. Fauci - - Dr. Fauci said the opposite - -,Pres,2020,2020-09-29,1,,,,,,,Republican,,,
Joe Biden,He did not say the opposite.,Pres,2020,2020-09-29,1,,,,,,,Democratic,,,
Chris Wallace,I want to ask you - -,Pres,2020,2020-09-29,0,,,,,,,Moderator,,,
Donald Trump,He said very strongly - -,Pres,2020,2020-09-29,1,,,,,,,Republican,,,
Chris Wallace,- - we've got a little bit longer than a minute left in this segment.,Pres,2020,2020-09-29,0,,,,,,,Moderator,,,
Donald Trump,"- - masks are not good. Then, he changed his mind. He said masks are good - - ",Pres,2020,2020-09-29,1,,,,,,,Republican,,,
Chris Wallace,I want to ask - -,Pres,2020,2020-09-29,0,,,,,,,Moderator,,,
Donald Trump,I'm ok with masks. I'm not fighting masks.,Pres,2020,2020-09-29,1,,,,,,,Republican,,,
Chris Wallace,"I want to ask you both about one last subject because your different approaches has even affected the way that you have campaigned. President Trump, you're holding the large rallies with crowds packed together, thousands of people. ",Pres,2020,2020-09-29,0,,,,,,,Moderator,,,
Donald Trump,Outside.,Pres,2020,2020-09-29,1,,,,,,,Republican,,,
Chris Wallace,"Outside. Yes, sir. Agreed. Vice President Biden, you are holding much smaller events with - ",Pres,2020,2020-09-29,0,,,,,,,Moderator,,,
Donald Trump,Because nobody will show up.,Pres,2020,2020-09-29,1,,,,,,,Republican,,,
Chris Wallace,- - people with masks.,Pres,2020,2020-09-29,0,,,,,,,Moderator,,,
Donald Trump,Well it's true. Nobody shows up to his rallies.,Pres,2020,2020-09-29,1,,,,,,,Republican,,,
Chris Wallace,"All right. In any case, why are you holding the big rallies? Why you not? You go first, sir. ",Pres,2020,2020-09-29,0,,,,,,,Moderator,,,
Donald Trump,Because people want to hear what I have to say. I mean -,Pres,2020,2020-09-29,1,,,,,,,Republican,,,
Joe Biden,(inaudible),Pres,2020,2020-09-29,1,,,,,,,Democratic,,,
Chris Wallace,But are you not worried about it spreading disease?,Pres,2020,2020-09-29,0,,,,,,,Moderator,,,
Donald Trump,"- - I've done a great job as a president and I'll have 25, 000, 35, 000 people show up at airports. We use airports and hangars. ",Pres,2020,2020-09-29,1,,,,,,,Republican,,,
Chris Wallace,"Are you not worried about the disease issue, sir? ",Pres,2020,2020-09-29,0,,,,,,,Moderator,,,
Donald Trump,"We have a lot of people - - well, so far we have had no problem whatsoever. It's outside. That's a big difference. According to the experts, we do them outside. We have tremendous crowds as you see. I mean, every - - and literally in 24 hours notice, and Joe does the circles and has three people some place. ",Pres,2020,2020-09-29,1,,,,,,,Republican,,,
Chris Wallace,ok.,Pres,2020,2020-09-29,0,,,,,,,Moderator,,,
Joe Biden,"By the way, did you - - did you - ",Pres,2020,2020-09-29,1,,,,,,,Democratic,,,
Chris Wallace,Got you.,Pres,2020,2020-09-29,0,,,,,,,Moderator,,,
Joe Biden,"_- see one of the last big rallies he had and a reporter came up to him to ask him a question. He said, "" No, no, no. Stand back. Put on your mask. Put on a mask. Have you been tested? "" I'm way - - I'm way far away from those other people. That's what he said. I can't. I'm going to be ok. He's not worried about you. He's not worried about the people out there breathing on one another, cheek to jowl. ",Pres,2020,2020-09-29,1,,,,,,,Democratic,,,
Donald Trump,We've had no negative effect.,Pres,2020,2020-09-29,1,,,,,,,Republican,,,
Joe Biden,No negative effect. Come on.,Pres,2020,2020-09-29,1,,,,,,,Democratic,,,
Donald Trump,"We've had no negative effect, and we've had - - ",Pres,2020,2020-09-29,1,,,,,,,Republican,,,
Chris Wallace,Well - -,Pres,2020,2020-09-29,0,,,,,,,Moderator,,,
Donald Trump,"- - 35, 000, 40, 000 people at these rallies. ",Pres,2020,2020-09-29,1,,,,,,,Republican,,,
Chris Wallace,- - you want to just quickly finish up -,Pres,2020,2020-09-29,0,,,,,,,Moderator,,,
Joe Biden,Yes.,Pres,2020,2020-09-29,1,,,,,,,Democratic,,,
Chris Wallace,- - because I want to move on to our next question?,Pres,2020,2020-09-29,0,,,,,,,Moderator,,,
Joe Biden,"Yes, I would. He's been totally irresponsible the way in which he has handled the social distancing and people wearing masks, basically encouraging them not to. ",Pres,2020,2020-09-29,1,,,,,,,Democratic,,,
Chris Wallace,All right.,Pres,2020,2020-09-29,0,,,,,,,Moderator,,,
Joe Biden,He's been - - he's a fool on this.,Pres,2020,2020-09-29,1,,,,,,,Democratic,,,
Donald Trump,"If you could get the crowds, you would have done the same thing, but you can't. Nobody cares. ",Pres,2020,2020-09-29,1,,,,,,,Republican,,,
Chris Wallace,"Gentlemen, can we move on to the - ",Pres,2020,2020-09-29,0,,,,,,,Moderator,,,
Donald Trump,Nobody cares.,Pres,2020,2020-09-29,1,,,,,,,Republican,,,
Chris Wallace,"Gentlemen, can we move onto the economy? ",Pres,2020,2020-09-29,0,,,,,,,Moderator,,,
Donald Trump,Yes.,Pres,2020,2020-09-29,1,,,,,,,Republican,,,
Chris Wallace,"The economy is, I think it's fair to say, recovering faster than expected from the shutdown - ",Pres,2020,2020-09-29,0,,,,,,,Moderator,,,
Donald Trump,Much faster.,Pres,2020,2020-09-29,1,,,,,,,Republican,,,
Chris Wallace,"- - in the second quarter. The unemployment rate fell to 8. 4 percent last month. The Federal Reserve says the hit to growth, which is going to be there, is not going to be nearly as big as they had expected. President Trump, you say we are in a V- shaped recovery. Vice President Biden, you say it's more of a K- shape. What difference does that mean to the American people in terms of the economy? President Trump, in this segment you go first. ",Pres,2020,2020-09-29,0,,,,,,,Moderator,,,
Donald Trump,"So we built the greatest economy in history. We closed it down because of the China plague. When the plague came in, we closed it down, which was very hard psychologically to do. He didn't think we should close it down, and he was wrong. And again, two million people would be dead now instead of - - still 204, 000 people is too much. One person is too much. It should have never happened from China, but what happened is we closed it down and now we're reopening, and we're doing record business. We had 10. 4 million in a four- month period that we've put back into the workforce. That's a record the likes of which nobody's ever seen before, and he wants to close down the - - he will shut it down again. He will destroy this country. You know, a lot of people between drugs and alcohol and depression, when you start shutting it down you take a look at what's happening at some of your Democrat- run states where they have these tough shutdowns, and I'm telling you it's because they don't want to open it. One of them came out last week - - you saw that - - we're going to up on November 9. Why November 9? Because it's after the election. They think they're hurting us by keeping them closed. They're hurting people. People know what to do. They can social distance. They can wash their hands. They can wear masks. They can do whatever they want, but they got to open these states up. When you look at North Carolina, when you look - - and these governors are under siege - - Pennsylvania, Michigan, and a couple of others, you've got to open these states up. It's not fair. You're talking about almost it's like being in prison. And you look at what's going on with divorce, look at what's going on with alcoholism and drugs, it's a very, very sad thing. And he'll close down the whole country. This guy will close down the whole country and destroy our country. Our country is coming back incredibly well, setting records as it does it. We don't need somebody to come in and say let's shut it down. ",Pres,2020,2020-09-29,1,"What impact have the COVID-19 shutdowns had on the economy and mental health, and why is reopening important?","- - in the second quarter. The unemployment rate fell to 8. 4 percent last month. The Federal Reserve says the hit to growth, which is going to be there, is not going to be nearly as big as they had expected. President Trump, you say we are in a V- shaped recovery. Vice President Biden, you say it's more of a K- shape. What difference does that mean to the American people in terms of the economy? President Trump, in this segment you go first. ",0.9470509291,0.9357432127,0.8014652729,0.3097851574,Republican,What difference does the V-shaped recovery versus K-shaped recovery mean to the American people in terms of the economy?,3,3
Chris Wallace,"All right, your two minutes, sir. We're now moved to you. As I - - as I said posing the question, the president says it's a V- shape recovery. You say it's a K- shaped recovery. What's the difference? ",Pres,2020,2020-09-29,0,,,,,,,Moderator,,,
Joe Biden,"The difference is millionaires and billionaires like him in the middle of the COVID crisis have done very well, and other billionaires have raised - - have made another $300 billion because of his profligate tax proposal and he only focuses on the market. But you folks at home, you folks living in Scranton and Claymont and all the small towns and working- class towns in America, how well are you doing? This guy paid - - ",Pres,2020,2020-09-29,1,How has the tax proposal affected income inequality during the COVID crisis?,"- - in the second quarter. The unemployment rate fell to 8. 4 percent last month. The Federal Reserve says the hit to growth, which is going to be there, is not going to be nearly as big as they had expected. President Trump, you say we are in a V- shaped recovery. Vice President Biden, you say it's more of a K- shape. What difference does that mean to the American people in terms of the economy? President Trump, in this segment you go first. ",0.9358017445,0.9230247736,0.8088583946,0.2356136739,Democratic,What difference does the V-shaped recovery versus K-shaped recovery mean to the American people in terms of the economy?,3,1
Donald Trump,Well.,Pres,2020,2020-09-29,1,,,,,,,Republican,,,
Joe Biden,- - a total of $750 in taxes.,Pres,2020,2020-09-29,1,,,,,,,Democratic,,,
Donald Trump,That's wrong.,Pres,2020,2020-09-29,1,,,,,,,Republican,,,
Chris Wallace,"Sir, sir, no. Wait, no. Sir it's his turn - ",Pres,2020,2020-09-29,0,,,,,,,Moderator,,,
Joe Biden,The economy - -,Pres,2020,2020-09-29,1,,,,,,,Democratic,,,
Donald Trump,It's just  a wrong statement.,Pres,2020,2020-09-29,1,,,,,,,Republican,,,
Chris Wallace,"Yes, I understand. You've agreed to the two minutes, so please let him have it. ",Pres,2020,2020-09-29,0,,,,,,,Moderator,,,
Joe Biden,"Do I get my time back? The fact is that he has, in fact, worked on this in a way that he's going to be the first President of the United States to leave office having fewer jobs in his administration than when he became president. First one in American history. Secondly, the people who have lost their jobs are those people who have been on the front lines. Those people who have been saving our lives, those people who have been out there dying. People who have been putting themselves in the way to make sure that we could all try to make it. And the idea that he is insisting that we - - and go forward and open when you have almost half the states in America with a significant increase in COVID deaths and COVID cases in the United States of America. And he wants to open it up more. Why does he want to open it up. Why doesn't he take care of the - - you can't fix the economy until you fix the COVID crisis. And he has no intention of doing anything about making it better for you all at home in terms of your health and your safety. Schools, why are schools open, because it cost a lot money to open them safely. You know they were going to give - - his administration were going to give the teachers in school students masks. And then they decided no, couldn't do that because it's not a national emergency. Not a national emergency. They've done nothing to help small businesses, nothing, they're closing. One in six is now gone. He ought to get on the job and take care of the needs of the American people so we can open safely. ",Pres,2020,2020-09-29,1,,,,,,,Democratic,,,
Chris Wallace,"All right. Your time is up, sir. We are going to get to  ",Pres,2020,2020-09-29,0,,,,,,,Moderator,,,
Donald Trump,"Well, I have to respond to that. ",Pres,2020,2020-09-29,1,,,,,,,Republican,,,
Chris Wallace,"Well, you both had two minutes, sir. ",Pres,2020,2020-09-29,0,,,,,,,Moderator,,,
Donald Trump,"Excuse me, he made a statement. ",Pres,2020,2020-09-29,1,,,,,,,Republican,,,
Chris Wallace,So did you.,Pres,2020,2020-09-29,0,,,,,,,Moderator,,,
Donald Trump,"People want their schools - - no. People want their schools open. They don't want to be shutdown. They don't want their states shutdown. They want their restaurants. I look at New York, it's so sad what's happening in New York. It's almost like a ghost town and I'm not sure it can ever recover what they've done in New York. People want their places open. They want to get back to their lives. ",Pres,2020,2020-09-29,1,,,,,,,Republican,,,
Joe Biden,People want to be safe.,Pres,2020,2020-09-29,1,,,,,,,Democratic,,,
Donald Trump,They'll be careful but they want their schools open.,Pres,2020,2020-09-29,1,,,,,,,Republican,,,
Joe Biden,People want to be safe.,Pres,2020,2020-09-29,1,,,,,,,Democratic,,,
Donald Trump,"I'm the one that brought back football. By the way, I brought back big fan football. It was me and I'm very happy to do it and the people of Ohio are very proud of me and  ",Pres,2020,2020-09-29,1,,,,,,,Republican,,,
Chris Wallace,"We're going to get back with the gentleman - - we're going to get to your economic plans going forward in a moment. But first, Mr. President, as you well know there's a new report that in 2016, the year you were elected president and 2017 your first year as president, that you paid $750 a year in federal income tax each of those years. I know that you pay a lot of other taxes but I'm asking you this specific question, is it true that you pay $750 in Federal income taxes each of those two years. ",Pres,2020,2020-09-29,0,,,,,,,Moderator,,,
Donald Trump,"I've paid millions of dollars in taxes, millions of dollars of income tax. And let me just tell you, there was a story in one of the papers  ",Pres,2020,2020-09-29,1,What is the significance of your tax payments in relation to recent news stories?,"We're going to get back with the gentleman - - we're going to get to your economic plans going forward in a moment. But first, Mr. President, as you well know there's a new report that in 2016, the year you were elected president and 2017 your first year as president, that you paid $750 a year in federal income tax each of those years. I know that you pay a lot of other taxes but I'm asking you this specific question, is it true that you pay $750 in Federal income taxes each of those two years. ",0.8928641081,0.9151718616,0.7744472027,0.5051336288,Republican,Is it true that you paid $750 in federal income taxes in 2016 and 2017?,2,2
Joe Biden,Show us your tax returns.,Pres,2020,2020-09-29,1,,,,,,,Democratic,,,
Donald Trump,I paid - - I paid $38 million one year. I paid $27 million one year.,Pres,2020,2020-09-29,1,,,,,,,Republican,,,
Joe Biden,Show us your tax returns.,Pres,2020,2020-09-29,1,,,,,,,Democratic,,,
Donald Trump,"I went - - you'll see it as soon as it's finished. You'll see it. You know if you wanted to, go to the Board of Elections, there's 118 page or so report that says everything I have, every bank I have. I'm totally underleveraged because the assets are extremely good and we have a very - - we have - - I built a great company. ",Pres,2020,2020-09-29,1,,,,,,,Republican,,,
Chris Wallace,"Sir, I'm asking you a specific question, which is  ",Pres,2020,2020-09-29,0,,,,,,,Moderator,,,
Donald Trump,But let me tell you,Pres,2020,2020-09-29,1,,,,,,,Republican,,,
Chris Wallace,I understand all of that - - I understand all of that,Pres,2020,2020-09-29,0,,,,,,,Moderator,,,
Donald Trump,But let me,Pres,2020,2020-09-29,1,,,,,,,Republican,,,
Chris Wallace,"No, Mr. President  ",Pres,2020,2020-09-29,0,,,,,,,Moderator,,,
Donald Trump,Go ahead.,Pres,2020,2020-09-29,1,,,,,,,Republican,,,
Chris Wallace,I'm asking you a question. Will you tell us how much you paid in federal income taxes in 2016 and 2017?,Pres,2020,2020-09-29,0,,,,,,,Moderator,,,
Donald Trump,Millions of dollars.,Pres,2020,2020-09-29,1,,,,,,,Republican,,,
Chris Wallace,You paid millions of dollars?,Pres,2020,2020-09-29,0,,,,,,,Moderator,,,
Donald Trump,"Millions of dollars, yes. ",Pres,2020,2020-09-29,1,,,,,,,Republican,,,
Chris Wallace,So not $750?,Pres,2020,2020-09-29,0,,,,,,,Moderator,,,
Donald Trump,Millions of dollars and you'll get to see it - - and you'll get to see it.,Pres,2020,2020-09-29,1,,,,,,,Republican,,,
Joe Biden,When?,Pres,2020,2020-09-29,1,,,,,,,Democratic,,,
Donald Trump,"But let me just tell you - - Chris, let me just you something that it was the tax laws - - I don't want to pay tax - - before I came here I was a private developer, I was a private business people. Like every other private person, unless they're stupid, they go through the laws and that's what it is. He passed a tax bill that gave us all these privileges for depreciation and for tax credits. We build a building and we get tax credits like the hotel on Pennsylvania Avenue, you get a massive  ",Pres,2020,2020-09-29,1,,,,,,,Republican,,,
Chris Wallace,ok.,Pres,2020,2020-09-29,0,,,,,,,Moderator,,,
Donald Trump," . which by the way, was given to me by the Obama administration if you can believe that. Now the man got fired right after that happened  ",Pres,2020,2020-09-29,1,,,,,,,Republican,,,
Chris Wallace,"No, no, let - - Vice President Biden, you want to respond? ",Pres,2020,2020-09-29,0,,,,,,,Moderator,,,
Joe Biden,"Yes, I do want to respond. Look, the tax code that made him - - put him in a position that he pays less tax than a school teacher makes - - on the money a school teacher makes is because of him taking - - he says he's smart because he can take advantage of the tax code. And he does take advantage of the tax code. That's why I'm going to eliminate the Trump tax cuts and we're going to - - I'm going to eliminate those tax cuts. ",Pres,2020,2020-09-29,1,,,,,,,Democratic,,,
Donald Trump,That's ok .,Pres,2020,2020-09-29,1,,,,,,,Republican,,,
Joe Biden,And make sure that we invest in the people who in fact need the help. People out there need help.,Pres,2020,2020-09-29,1,,,,,,,Democratic,,,
Donald Trump,But why didn't you over 20 - - the last 25 years?,Pres,2020,2020-09-29,1,,,,,,,Republican,,,
Joe Biden,Because you weren't president,Pres,2020,2020-09-29,1,,,,,,,Democratic,,,
Donald Trump,Why didn't you do it over the last 25 years?,Pres,2020,2020-09-29,1,,,,,,,Republican,,,
Joe Biden,Because you weren't president screwing things up.,Pres,2020,2020-09-29,1,,,,,,,Democratic,,,
Donald Trump,"No, no, no. You were a senator and by the way you were  ",Pres,2020,2020-09-29,1,,,,,,,Republican,,,
Joe Biden,You're the worst president America has ever had. Come on.,Pres,2020,2020-09-29,1,,,,,,,Democratic,,,
Donald Trump,"Hey - - hey, Joe, let me - - let me just say, Joe, I've done more in - - in 47 months I've done more than you've done in 47 years, Joe. We've done things that you never even thought of doing . ",Pres,2020,2020-09-29,1,,,,,,,Republican,,,
Chris Wallace,"ok, gentlemen - - ",Pres,2020,2020-09-29,0,,,,,,,Moderator,,,
Donald Trump,"Including fixing the broken military that you gave me, including taking care of your  vets. ",Pres,2020,2020-09-29,1,,,,,,,Republican,,,
Chris Wallace,"Mr. President, we're talking about the economy. I'd like to ask you about your plans going forward because, Mr. Vice President, your economic plan if you were to be elected president focuses a lot on big government, big taxes, big spending. I want to focus first on the taxes. You proposed more than $4 trillion over a decade on new taxes on individuals making more than $400, 000 a year and on corporations. President Trump says that that kind of an increase in taxes is going to hurt the economy as it's just coming out of a recession. ",Pres,2020,2020-09-29,0,,,,,,,Moderator,,,
